{
  "id": "task:UWpMMFp1S2prTG83cmhOSw",
  "source_type": "google_tasks",
  "retrieved_at": "2026-03-23T02:26:13.311429+00:00",
  "title": "HUUROVEREENKOMST RK62",
  "notes": "https://drive.google.com/drive/folders/1iRaF175q_E_uw7fxz9lwAhYUoGphrK3u\n\n1\n2\n3\n4\n5\n6",
  "status": "needsAction",
  "due": "2025-07-11T00:00:00.000Z",
  "completed_at": "",
  "tasklist_id": "MDg4MDY5OTg5NzUwNzAwMTk5MjE6MDow"
}