{
  "id": "task:ZkJLUmR4ajdkMUhCemUzTQ",
  "source_type": "google_tasks",
  "retrieved_at": "2026-03-23T02:26:13.311429+00:00",
  "title": "Prgs",
  "notes": "",
  "status": "needsAction",
  "due": "2026-03-22T00:00:00.000Z",
  "completed_at": "",
  "tasklist_id": "MDg4MDY5OTg5NzUwNzAwMTk5MjE6MDow"
}