{
  "id": "task:TnI4eTk5TVFxZ25zTUFRLQ",
  "source_type": "google_tasks",
  "retrieved_at": "2026-03-23T02:26:13.311429+00:00",
  "title": "sls rapport deep research klaar is",
  "notes": "",
  "status": "needsAction",
  "due": "",
  "completed_at": "",
  "tasklist_id": "MDg4MDY5OTg5NzUwNzAwMTk5MjE6MDow"
}