{
  "id": "task:N2M3dW54VTJSWWl6bFZqMA",
  "source_type": "google_tasks",
  "retrieved_at": "2026-03-23T02:26:13.311429+00:00",
  "title": "PLAYBOOK: EINDAFSPRAAK",
  "notes": "1\n2\n3\n4\n5",
  "status": "needsAction",
  "due": "2025-08-22T00:00:00.000Z",
  "completed_at": "",
  "tasklist_id": "MDg4MDY5OTg5NzUwNzAwMTk5MjE6MDow"
}