{
  "id": "task:WGZpQVd4OTR3TVRFTlM2RA",
  "source_type": "google_tasks",
  "retrieved_at": "2026-03-23T02:26:13.311429+00:00",
  "title": "VERKOOPOPDRACHT KLANT 14.1",
  "notes": "1\n2\n3\n4\n5\n6",
  "status": "needsAction",
  "due": "2025-06-01T00:00:00.000Z",
  "completed_at": "",
  "tasklist_id": "MDg4MDY5OTg5NzUwNzAwMTk5MjE6MDow"
}