{
  "id": "task:a2pVTUNyTmkyS29GckR1VA",
  "source_type": "google_tasks",
  "retrieved_at": "2026-03-23T02:26:13.311429+00:00",
  "title": "Foto's maken voor opleveringslijst",
  "notes": "1\n2\n3\n4",
  "status": "needsAction",
  "due": "2025-07-09T00:00:00.000Z",
  "completed_at": "",
  "tasklist_id": "MDg4MDY5OTg5NzUwNzAwMTk5MjE6MDow"
}