{
  "id": "task:WlkwTndUSGgxYWo1LVlNag",
  "source_type": "google_tasks",
  "retrieved_at": "2026-03-23T02:26:13.311429+00:00",
  "title": "Sleutels kopi\u00eben",
  "notes": "1\n\n2\n3\n4f\n5\n6",
  "status": "needsAction",
  "due": "2025-07-08T00:00:00.000Z",
  "completed_at": "",
  "tasklist_id": "MDg4MDY5OTg5NzUwNzAwMTk5MjE6MDow"
}